{
 "generated_utc": "2026-10-17T18:45:56Z",
 "source": "DefiLlama (api.llama.fi/protocols, /v2/chains)",
 "matched": {
  "arbitrum:0x1a3c9b1d2f0529d97f2afc5136cc23e58f1fd35b": {
   "slug": "camelot-v3",
   "name": "Camelot V3",
   "tvl": 3432672.6820296305,
   "scope": "chain",
   "chain": "Arbitrum",
   "category": "Dexs"
  },
  "arbitrum:0xe23b4ae3624fb6f7cdef29bc8ead912f1ede6886": {
   "slug": "radiant-v2",
   "name": "Radiant V2",
   "tvl": 179045.33152892644,
   "scope": "chain",
   "chain": "Arbitrum",
   "category": "Lending"
  },
  "arbitrum:0x423552c0f05baccac5bfa91c6dcf1dc53a0a1641": {
   "slug": null,
   "name": "Arbitrum (whole chain)",
   "tvl": 1399963892.8267374,
   "scope": "chain-total",
   "chain": "Arbitrum"
  },
  "arbitrum:0xa97684ead0e402dc232d5a977953df7ecbab3cdb": {
   "slug": "aave-v3",
   "name": "Aave V3",
   "tvl": 535060356.5400523,
   "scope": "chain",
   "chain": "Arbitrum",
   "category": "Lending"
  },
  "arbitrum:0x9c4ec768c28520b50860ea7a15bd7213a9ff58bf": {
   "slug": "compound-v3",
   "name": "Compound V3",
   "tvl": 66452496.716674455,
   "scope": "chain",
   "chain": "Arbitrum",
   "category": "Lending"
  },
  "arbitrum:0x888888888889758f76e7103c6cbf23abbf58f946": {
   "slug": "pendle-v2",
   "name": "Pendle V2",
   "tvl": 53668916.970584944,
   "scope": "chain",
   "chain": "Arbitrum",
   "category": "Yield"
  },
  "arbitrum:0x52aa899454998be5b000ad077a46bbe360f4e497": {
   "slug": "fluid-lending",
   "name": "Fluid Lending",
   "tvl": 134645230.5368468,
   "scope": "chain",
   "chain": "Arbitrum",
   "category": "Lending"
  },
  "arbitrum:0x1f98431c8ad98523631ae4a59f267346ea31f984": {
   "slug": "uniswap-v3",
   "name": "Uniswap V3",
   "tvl": 132290971.60589081,
   "scope": "chain",
   "chain": "Arbitrum",
   "category": "Dexs"
  },
  "base:0xbbbbbbbbbb9cc5e90e3b3af64bdaf62c37eeffcb": {
   "slug": "morpho-blue",
   "name": "Morpho Blue",
   "tvl": 4394375799.241934,
   "scope": "chain",
   "chain": "Base",
   "category": "Lending"
  },
  "base:0xe20fcbdbffc4dd138ce8b2e6fbb6cb49777ad64d": {
   "slug": "aave-v3",
   "name": "Aave V3",
   "tvl": 547088945.4362956,
   "scope": "chain",
   "chain": "Base",
   "category": "Lending"
  },
  "base:0x420dd381b31aef6683db6b902084cb0ffece40da": {
   "slug": "aerodrome-v1",
   "name": "Aerodrome V1",
   "tvl": 137682268.49271694,
   "scope": "chain",
   "chain": "Base",
   "category": "Dexs"
  },
  "base:0x33128a8fc17869897dce68ed026d694621f6fdfd": {
   "slug": "uniswap-v3",
   "name": "Uniswap V3",
   "tvl": 308215491.5522518,
   "scope": "chain",
   "chain": "Base",
   "category": "Dexs"
  },
  "base:0xb125e6687d4313864e53df431d5425969c15eb2f": {
   "slug": "compound-v3",
   "name": "Compound V3",
   "tvl": 25229450.690089088,
   "scope": "chain",
   "chain": "Base",
   "category": "Lending"
  },
  "base:0x5e7bb104d84c7cb9b682aac2f3d509f5f406809a": {
   "slug": "aerodrome-slipstream",
   "name": "Aerodrome Slipstream",
   "tvl": 233567431.21740204,
   "scope": "chain",
   "chain": "Base",
   "category": "Dexs"
  },
  "base:0x8909dc15e40173ff4699343b6eb8132c65e18ec6": {
   "slug": "uniswap-v2",
   "name": "Uniswap V2",
   "tvl": 92773547.0913212,
   "scope": "chain",
   "chain": "Base",
   "category": "Dexs"
  },
  "base:0x498581ff718922c3f8e6a244956af099b2652b2b": {
   "slug": "uniswap-v4",
   "name": "Uniswap V4",
   "tvl": 69683756.5012371,
   "scope": "chain",
   "chain": "Base",
   "category": "Dexs"
  },
  "base:0xfbb21d0380bee3312b33c4353c8936a0f13ef26c": {
   "slug": "moonwell-lending",
   "name": "Moonwell Lending",
   "tvl": 10538841.966302643,
   "scope": "chain",
   "chain": "Base",
   "category": "Lending"
  },
  "ethereum-l1:0x1f98431c8ad98523631ae4a59f267346ea31f984": {
   "slug": "uniswap-v3",
   "name": "Uniswap V3",
   "tvl": 884653857.2222807,
   "scope": "chain",
   "chain": "Ethereum",
   "category": "Dexs"
  },
  "ethereum-l1:0x2f39d218133afab8f2b819b1066c7e434ad94e9e": {
   "slug": "aave-v3",
   "name": "Aave V3",
   "tvl": 14009107783.338797,
   "scope": "chain",
   "chain": "Ethereum",
   "category": "Lending"
  },
  "ethereum-l1:0xbe286431454714f511008713973d3b053a2d38f3": {
   "slug": "sky-lending",
   "name": "Sky Lending",
   "tvl": 5654228713.092538,
   "scope": "chain",
   "chain": "Ethereum",
   "category": "CDP"
  },
  "ethereum-l1:0x2cc440b721d2cafd6d64908d6d8c4acc57f8afc3": {
   "slug": "ethena-usde",
   "name": "Ethena USDe",
   "tvl": 4682902748.771042,
   "scope": "chain",
   "chain": "Ethereum",
   "category": "Basis Trading"
  },
  "ethereum-l1:0xc139190f447e929f090edeb554d95abb8b18ac1c": {
   "slug": "ethena-usdtb",
   "name": "Ethena USDtb",
   "tvl": 475915025.8829521,
   "scope": "chain",
   "chain": "Ethereum",
   "category": "RWA"
  },
  "ethereum-l1:0x73e35c5c35a274e34ade6eb13cc7f62aee323728": {
   "slug": "ethena-usdtb",
   "name": "Ethena USDtb",
   "tvl": 475915025.8829521,
   "scope": "chain",
   "chain": "Ethereum",
   "category": "RWA"
  },
  "ethereum-l1:0x5d3a1ff2b6bab83b63cd9ad0787074081a52ef34": {
   "slug": "ethena-usde",
   "name": "Ethena USDe",
   "tvl": 4682902748.771042,
   "scope": "chain",
   "chain": "Ethereum",
   "category": "Basis Trading"
  },
  "ethereum-l1:0x211cc4dd073734da055fbf44a2b4667d5e5fe5d2": {
   "slug": "ethena-usde",
   "name": "Ethena USDe",
   "tvl": 4682902748.771042,
   "scope": "chain",
   "chain": "Ethereum",
   "category": "Basis Trading"
  },
  "ethereum-l1:0x58538e6a46e07434d7e7375bc268d3cb839c0133": {
   "slug": "ethena-usde",
   "name": "Ethena USDe",
   "tvl": 4682902748.771042,
   "scope": "chain",
   "chain": "Ethereum",
   "category": "Basis Trading"
  },
  "ethereum-l1:0xc3d688b66703497daa19211eedff47f25384cdc3": {
   "slug": "compound-v3",
   "name": "Compound V3",
   "tvl": 1281049621.6185305,
   "scope": "chain",
   "chain": "Ethereum",
   "category": "Lending"
  },
  "ethereum-l1:0x02c3ea4e34c0cbd694d2adfa2c690eecbc1793ee": {
   "slug": "sparklend",
   "name": "SparkLend",
   "tvl": 5043945619.232928,
   "scope": "chain",
   "chain": "Ethereum",
   "category": "Lending"
  },
  "ethereum-l1:0x000000000004444c5dc75cb358380d2e3de08a90": {
   "slug": "uniswap-v4",
   "name": "Uniswap V4",
   "tvl": 782595938.8990059,
   "scope": "chain",
   "chain": "Ethereum",
   "category": "Dexs"
  },
  "ethereum-l1:0xbbbbbbbbbb9cc5e90e3b3af64bdaf62c37eeffcb": {
   "slug": "morpho-blue",
   "name": "Morpho Blue",
   "tvl": 5009943843.15756,
   "scope": "chain",
   "chain": "Ethereum",
   "category": "Lending"
  },
  "ethereum-l1:0x2260fac5e5542a773aa44fbcfedf7c193bc2c599": {
   "slug": "wbtc",
   "name": "WBTC",
   "tvl": 9460142422.216293,
   "scope": "total",
   "chain": null,
   "category": "Bridge"
  },
  "ethereum-l1:0xe3490297a08d6fc8da46edb7b6142e4f461b62d3": {
   "slug": "ethena-usde",
   "name": "Ethena USDe",
   "tvl": 4682902748.771042,
   "scope": "chain",
   "chain": "Ethereum",
   "category": "Basis Trading"
  },
  "ethereum-l1:0xae7ab96520de3a18e5e111b5eaab095312d7fe84": {
   "slug": "lido",
   "name": "Lido",
   "tvl": 23333150450.256214,
   "scope": "chain",
   "chain": "Ethereum",
   "category": "Liquid Staking"
  },
  "ethereum-l1:0x858646372cc42e1a627fce94aa7a7033e7cf075a": {
   "slug": "eigencloud",
   "name": "EigenCloud",
   "tvl": 6214707223.112749,
   "scope": "chain",
   "chain": "Ethereum",
   "category": "Restaking"
  },
  "ethereum-l1:0x6a8cbed756804b16e05e741edabd5cb544ae21bf": {
   "slug": "curve-dex",
   "name": "Curve DEX",
   "tvl": 1136535133.8510258,
   "scope": "chain",
   "chain": "Ethereum",
   "category": "Dexs"
  },
  "ethereum-l1:0x1d8f8f00cfa6758d7be78336684788fb0ee0fa46": {
   "slug": "rocket-pool",
   "name": "Rocket Pool",
   "tvl": 1239794685.4416409,
   "scope": "chain",
   "chain": "Ethereum",
   "category": "Liquid Staking"
  },
  "ethereum-l1:0xf403c135812408bfbe8713b5a23a04b3d48aae31": {
   "slug": "convex-finance",
   "name": "Convex Finance",
   "tvl": 563363971.1035643,
   "scope": "chain",
   "chain": "Ethereum",
   "category": "Yield"
  },
  "hyperliquid:0xea394cd63ca3a5c8a130bb2b955cc71c22e5ea6c": {
   "slug": "hyperliquid-bridge",
   "name": "Hyperliquid Bridge",
   "tvl": 6330957481.418051,
   "scope": "chain",
   "chain": "Hyperliquid L1",
   "category": "Bridge"
  },
  "hyperliquid:0x71f0019cc7fa79e4f42587fb7b9a817d8d2429ec": {
   "slug": "kinetiq-kmhype",
   "name": "Kinetiq kmHYPE",
   "tvl": 40797281.64662598,
   "scope": "chain",
   "chain": "Hyperliquid L1",
   "category": "Liquid Staking"
  },
  "hyperliquid:0x8888888192a4a0593c13532ba48449fc24c3beda": {
   "slug": "ventuals",
   "name": "Ventuals",
   "tvl": 414807.26693222916,
   "scope": "chain",
   "chain": "Hyperliquid L1",
   "category": "Interface"
  },
  "hyperliquid:0x393d0b87ed38fc779fd9611144ae649ba6082109": {
   "slug": "kinetiq-khype",
   "name": "Kinetiq kHYPE",
   "tvl": 844439562.2371548,
   "scope": "chain",
   "chain": "Hyperliquid L1",
   "category": "Liquid Staking"
  },
  "hyperliquid:0xdfc24b077bc1425ad1dea75bcb6f8158e10df303": {
   "slug": "hyperliquid-hlp",
   "name": "Hyperliquid HLP",
   "tvl": 177833641.0866028,
   "scope": "chain",
   "chain": "Hyperliquid L1",
   "category": "Derivatives"
  },
  "hyperliquid:0x574bafce69d9411f662a433896e74e4f153096fa": {
   "slug": "unit",
   "name": "Unit",
   "tvl": 946987941.6182207,
   "scope": "total",
   "chain": null,
   "category": "Bridge"
  },
  "hyperliquid:0x8dafbe89302656a7df43c470e9ebcb4c540835c0": {
   "slug": "unit",
   "name": "Unit",
   "tvl": 946987941.6182207,
   "scope": "total",
   "chain": null,
   "category": "Bridge"
  },
  "hyperliquid:0xa822a9ceb6d6cb5b565bd10098abcfa9cf18d748": {
   "slug": "unit",
   "name": "Unit",
   "tvl": 946987941.6182207,
   "scope": "total",
   "chain": null,
   "category": "Bridge"
  },
  "hyperliquid:0x2df1c51e09aecf9cacb7bc98cb1742757f163df7": {
   "slug": "hyperliquid-bridge",
   "name": "Hyperliquid Bridge",
   "tvl": 397326321.1391177,
   "scope": "chain",
   "chain": "Arbitrum",
   "category": "Bridge"
  },